{
  "schema_version": "1.0",
  "recording_id": "sample_01",
  "draft": true,
  "audio": {
    "filename": "sample_01.mp3",
    "sha256": "992feada7a67a56ee2881e0e2dc6ae8980d3190238be26c58d5b29b323b47989",
    "duration_sec": null
  },
  "label_set": [
    "Agent",
    "Customer"
  ],
  "overlap_policy": "allow_overlapping_intervals",
  "unlabeled_policy": "do_not_score",
  "warnings": [
    "DRAFT: every interval is transcript-role migration, NOT audio-verified.",
    "Interval boundaries follow reference ASR cuts from ref_eval_2026-09-20, not independent listen-pass marks.",
    "Do not use this file alone to claim DER or audio-verified attribution accuracy."
  ],
  "intervals": [
    {
      "id": "s01-i000",
      "start_sec": 7.79,
      "end_sec": 11.31,
      "label": "Agent",
      "status": "clear",
      "tags": [
        "migrated_from_ref_index_map",
        "not_audio_verified"
      ],
      "provenance": {
        "method": "manual_transcript_review",
        "basis": "asr_text_role",
        "audio_verified": false,
        "confidence": "medium",
        "annotator": "ref_eval_manual_sample01_notes",
        "source_system": "ref_eval_2026-09-20",
        "source_segment_index": 0,
        "notes": "Migrated from call-center-ref-eval evaluation/score_against_anchors.py manual_sample01_notes(). Labels assigned by reading reference ASR text, not by listening to audio. Timestamps taken from reference prediction segment boundaries for that run. NOT acoustic ground truth."
      }
    },
    {
      "id": "s01-i001",
      "start_sec": 11.63,
      "end_sec": 13.07,
      "label": "Customer",
      "status": "clear",
      "tags": [
        "migrated_from_ref_index_map",
        "not_audio_verified"
      ],
      "provenance": {
        "method": "manual_transcript_review",
        "basis": "asr_text_role",
        "audio_verified": false,
        "confidence": "medium",
        "annotator": "ref_eval_manual_sample01_notes",
        "source_system": "ref_eval_2026-09-20",
        "source_segment_index": 1,
        "notes": "Migrated from call-center-ref-eval evaluation/score_against_anchors.py manual_sample01_notes(). Labels assigned by reading reference ASR text, not by listening to audio. Timestamps taken from reference prediction segment boundaries for that run. NOT acoustic ground truth."
      }
    },
    {
      "id": "s01-i002",
      "start_sec": 14.22,
      "end_sec": 15.54,
      "label": "Agent",
      "status": "clear",
      "tags": [
        "migrated_from_ref_index_map",
        "not_audio_verified"
      ],
      "provenance": {
        "method": "manual_transcript_review",
        "basis": "asr_text_role",
        "audio_verified": false,
        "confidence": "medium",
        "annotator": "ref_eval_manual_sample01_notes",
        "source_system": "ref_eval_2026-09-20",
        "source_segment_index": 2,
        "notes": "Migrated from call-center-ref-eval evaluation/score_against_anchors.py manual_sample01_notes(). Labels assigned by reading reference ASR text, not by listening to audio. Timestamps taken from reference prediction segment boundaries for that run. NOT acoustic ground truth."
      }
    },
    {
      "id": "s01-i003",
      "start_sec": 16.18,
      "end_sec": 20.4,
      "label": "Customer",
      "status": "clear",
      "tags": [
        "migrated_from_ref_index_map",
        "not_audio_verified"
      ],
      "provenance": {
        "method": "manual_transcript_review",
        "basis": "asr_text_role",
        "audio_verified": false,
        "confidence": "medium",
        "annotator": "ref_eval_manual_sample01_notes",
        "source_system": "ref_eval_2026-09-20",
        "source_segment_index": 3,
        "notes": "Migrated from call-center-ref-eval evaluation/score_against_anchors.py manual_sample01_notes(). Labels assigned by reading reference ASR text, not by listening to audio. Timestamps taken from reference prediction segment boundaries for that run. NOT acoustic ground truth."
      }
    },
    {
      "id": "s01-i004",
      "start_sec": 20.76,
      "end_sec": 23.98,
      "label": "Agent",
      "status": "clear",
      "tags": [
        "migrated_from_ref_index_map",
        "not_audio_verified"
      ],
      "provenance": {
        "method": "manual_transcript_review",
        "basis": "asr_text_role",
        "audio_verified": false,
        "confidence": "medium",
        "annotator": "ref_eval_manual_sample01_notes",
        "source_system": "ref_eval_2026-09-20",
        "source_segment_index": 4,
        "notes": "Migrated from call-center-ref-eval evaluation/score_against_anchors.py manual_sample01_notes(). Labels assigned by reading reference ASR text, not by listening to audio. Timestamps taken from reference prediction segment boundaries for that run. NOT acoustic ground truth."
      }
    },
    {
      "id": "s01-i005",
      "start_sec": 24.2,
      "end_sec": 26.36,
      "label": null,
      "status": "ambiguous",
      "tags": [
        "mixed_speaker_asr",
        "merged_turn",
        "migrated_from_ref_index_map"
      ],
      "provenance": {
        "method": "manual_transcript_review",
        "basis": "asr_text_role",
        "audio_verified": false,
        "confidence": "low",
        "annotator": "ref_eval_manual_sample01_notes",
        "source_system": "ref_eval_2026-09-20",
        "source_segment_index": 5,
        "notes": "Migrated from call-center-ref-eval evaluation/score_against_anchors.py manual_sample01_notes(). Labels assigned by reading reference ASR text, not by listening to audio. Timestamps taken from reference prediction segment boundaries for that run. NOT acoustic ground truth."
      }
    },
    {
      "id": "s01-i006",
      "start_sec": 26.62,
      "end_sec": 27.18,
      "label": "Agent",
      "status": "clear",
      "tags": [
        "migrated_from_ref_index_map",
        "not_audio_verified"
      ],
      "provenance": {
        "method": "manual_transcript_review",
        "basis": "asr_text_role",
        "audio_verified": false,
        "confidence": "medium",
        "annotator": "ref_eval_manual_sample01_notes",
        "source_system": "ref_eval_2026-09-20",
        "source_segment_index": 6,
        "notes": "Migrated from call-center-ref-eval evaluation/score_against_anchors.py manual_sample01_notes(). Labels assigned by reading reference ASR text, not by listening to audio. Timestamps taken from reference prediction segment boundaries for that run. NOT acoustic ground truth."
      }
    },
    {
      "id": "s01-i007",
      "start_sec": 27.56,
      "end_sec": 30.14,
      "label": "Customer",
      "status": "clear",
      "tags": [
        "migrated_from_ref_index_map",
        "not_audio_verified"
      ],
      "provenance": {
        "method": "manual_transcript_review",
        "basis": "asr_text_role",
        "audio_verified": false,
        "confidence": "medium",
        "annotator": "ref_eval_manual_sample01_notes",
        "source_system": "ref_eval_2026-09-20",
        "source_segment_index": 7,
        "notes": "Migrated from call-center-ref-eval evaluation/score_against_anchors.py manual_sample01_notes(). Labels assigned by reading reference ASR text, not by listening to audio. Timestamps taken from reference prediction segment boundaries for that run. NOT acoustic ground truth."
      }
    },
    {
      "id": "s01-i008",
      "start_sec": 30.86,
      "end_sec": 33.28,
      "label": "Agent",
      "status": "clear",
      "tags": [
        "migrated_from_ref_index_map",
        "not_audio_verified"
      ],
      "provenance": {
        "method": "manual_transcript_review",
        "basis": "asr_text_role",
        "audio_verified": false,
        "confidence": "medium",
        "annotator": "ref_eval_manual_sample01_notes",
        "source_system": "ref_eval_2026-09-20",
        "source_segment_index": 8,
        "notes": "Migrated from call-center-ref-eval evaluation/score_against_anchors.py manual_sample01_notes(). Labels assigned by reading reference ASR text, not by listening to audio. Timestamps taken from reference prediction segment boundaries for that run. NOT acoustic ground truth."
      }
    },
    {
      "id": "s01-i009",
      "start_sec": 33.72,
      "end_sec": 36.72,
      "label": "Customer",
      "status": "clear",
      "tags": [
        "migrated_from_ref_index_map",
        "not_audio_verified"
      ],
      "provenance": {
        "method": "manual_transcript_review",
        "basis": "asr_text_role",
        "audio_verified": false,
        "confidence": "medium",
        "annotator": "ref_eval_manual_sample01_notes",
        "source_system": "ref_eval_2026-09-20",
        "source_segment_index": 9,
        "notes": "Migrated from call-center-ref-eval evaluation/score_against_anchors.py manual_sample01_notes(). Labels assigned by reading reference ASR text, not by listening to audio. Timestamps taken from reference prediction segment boundaries for that run. NOT acoustic ground truth."
      }
    },
    {
      "id": "s01-i010",
      "start_sec": 36.72,
      "end_sec": 38.36,
      "label": "Agent",
      "status": "clear",
      "tags": [
        "migrated_from_ref_index_map",
        "not_audio_verified"
      ],
      "provenance": {
        "method": "manual_transcript_review",
        "basis": "asr_text_role",
        "audio_verified": false,
        "confidence": "medium",
        "annotator": "ref_eval_manual_sample01_notes",
        "source_system": "ref_eval_2026-09-20",
        "source_segment_index": 10,
        "notes": "Migrated from call-center-ref-eval evaluation/score_against_anchors.py manual_sample01_notes(). Labels assigned by reading reference ASR text, not by listening to audio. Timestamps taken from reference prediction segment boundaries for that run. NOT acoustic ground truth."
      }
    },
    {
      "id": "s01-i011",
      "start_sec": 38.86,
      "end_sec": 41.08,